{
  "version": "0.1",
  "drawing_id": "drawing-commercial-fitout-reception-sample",
  "source": "project_sample_fixture",
  "units": "mm",
  "layers": [
    {
      "name": "CODEX_PREVIEW",
      "role": "preview",
      "entity_count": 0
    }
  ],
  "entities_summary": {
    "line_count": 0,
    "text_count": 0,
    "dimension_count": 0,
    "block_count": 0
  },
  "spaces": [],
  "openings": [],
  "uncertainties": ["No real DWG readback is attached to this commercial fitout reception sample."]
}
